{
  "schema_version": "partition-manifest-v1",
  "layer": "features",
  "dataset_kind": "trade_microstructure",
  "venue": "bybit",
  "instrument": "BTCUSDT",
  "record_schema_id": "feature-set-v1",
  "partition_key": "dt=2026-08-25",
  "revision": 2,
  "state": "superseded",
  "rel_path": "dt=2026-08-25/part-000.parquet",
  "file_size_bytes": 48211934,
  "row_count": 1842776,
  "sha256": "9f2c1b7a4e0d63558a1cf90b2e77d4a6cc38b915de204671f8ab3c5d9e0172b4",
  "first_exchange_ts": "2026-08-25T00:00:00.014287Z",
  "last_exchange_ts": "2026-08-25T23:59:59.982104Z",
  "first_sequence": "0",
  "last_sequence": "86399",
  "created_at": "2026-08-25T00:00:00.001Z",
  "closed_at": "2026-08-26T00:00:04.220Z",
  "producer": "trade-microstructure-builder",
  "code_ref": "d92aa10",
  "feature_set_slug": "trade_microstructure",
  "feature_set_version": 1
}
